{
  "kind": "reeval-insights",
  "schemaVersion": 1,
  "runId": "20261025T201323Z_e097aaf_cursor-agent_9kkm",
  "model": "none",
  "promptVersion": "none",
  "factsHash": "sha256:e52a3d428869793624a75bb58446e16b5a3f043db3a6339bb36f025177852ec3",
  "createdAt": "2026-10-25T20:13:55.699Z",
  "usage": {
    "inputTokens": 0,
    "outputTokens": 0,
    "costUsd": null
  },
  "headline": null,
  "evals": [],
  "remarks": [
    {
      "id": "faf8bd289fb52c86d261daef1d135dd19f0f9911a053c7e8fc4f8593645fe48b",
      "evalId": "evals%2Fcases.eval.ts › greets %25s",
      "kind": "too-few-tries",
      "severity": "suggestion",
      "text": "With-house-greeting on fake passed 1 of 1 try and plain 0 of 1: too few tries to tell whether the difference holds.",
      "evidence": [
        "evals%2Fcases.eval.ts › greets %25s/Ada/fake+with-house-greeting+docker",
        "evals%2Fcases.eval.ts › greets %25s/Ada/fake+plain+docker"
      ],
      "fix": {
        "at": "source:evals/cases.eval.ts#L11",
        "edit": "set runs: 4 or more, so each side counts at least 4 tries"
      },
      "origin": "deterministic",
      "firstSeenRun": "20261025T201323Z_e097aaf_cursor-agent_9kkm",
      "printed": false
    },
    {
      "id": "4ec68419e1340938897697ca2096a8ae9e5604a05da3c7f3037373007cdf0628",
      "evalId": "evals%2Fskill.eval.ts › house greeting › greets in the house style",
      "kind": "too-few-tries",
      "severity": "suggestion",
      "text": "With-house-greeting on fake passed 1 of 1 try and plain 0 of 1: too few tries to tell whether the difference holds.",
      "evidence": [
        "evals%2Fskill.eval.ts › house greeting › greets in the house style/fake+with-house-greeting+docker",
        "evals%2Fskill.eval.ts › house greeting › greets in the house style/fake+plain+docker"
      ],
      "fix": {
        "at": "source:evals/skill.eval.ts#L26",
        "edit": "set runs: 4 or more, so each side counts at least 4 tries"
      },
      "origin": "deterministic",
      "firstSeenRun": "20261025T201323Z_e097aaf_cursor-agent_9kkm",
      "printed": false
    }
  ],
  "validation": {
    "dropped": 0,
    "regenerated": 0
  }
}
