{
  "kind": "reeval-insights",
  "schemaVersion": 1,
  "runId": "20261021T185234Z_f3a9e44_cursor-agent_994w",
  "model": "fake",
  "promptVersion": "insights-v5",
  "factsHash": "sha256:6f1911bfab28c7c93e4205b19fb15e757685aa590e9e20129b94df953b8e2e80",
  "createdAt": "2026-10-21T18:52:38.013Z",
  "usage": {
    "inputTokens": 2583,
    "outputTokens": 96,
    "costUsd": null
  },
  "budget": {
    "maxTokens": 250000,
    "skipped": []
  },
  "headline": {
    "text": "1 fail; start with \"lands heads on the first try\".",
    "cites": [
      "evals%2Fcoin.eval.ts › lands heads on the first try"
    ]
  },
  "evals": [
    {
      "evalId": "evals%2Fcoin.eval.ts › lands heads on the first try",
      "intent": {
        "job": "finish",
        "across": "none",
        "question": "Does the agent finish: lands heads on the first try?",
        "subject": {},
        "name": "states-intent",
        "key": "6c510fa449ef1cc730ed49d775f800c422f790566b62e4e6c94bcd0bc7e31758"
      },
      "answer": {
        "text": "No: only 1 of 3 passed \"lands heads\".",
        "cites": [
          "evals%2Fcoin.eval.ts › lands heads on the first try/fake+fake+fake/checks/lands heads"
        ]
      },
      "findings": []
    },
    {
      "evalId": "evals%2Fskill.eval.ts › uses the marker with the marked skill",
      "intent": {
        "job": "finish",
        "across": "change",
        "question": "Does the agent finish: uses the marker with the marked skill?",
        "subject": {
          "change": "marked"
        },
        "name": "states-intent",
        "key": "3e0fd22aec0d035c2a53baad38e875ce17ea333f2cf96292b383eb20af4ae62e"
      },
      "answer": {
        "text": "Yes: every try passed.",
        "cites": [
          "evals%2Fskill.eval.ts › uses the marker with the marked skill"
        ]
      },
      "findings": [],
      "rows": [
        {
          "text": "Only 0 of 2 passed \"uses the marker\".",
          "cites": [
            "evals%2Fskill.eval.ts › uses the marker with the marked skill/fake+plain+docker/checks/uses the marker"
          ],
          "row": "evals%2Fskill.eval.ts › uses the marker with the marked skill/fake+plain+docker"
        }
      ]
    }
  ],
  "remarks": [
    {
      "id": "35012c9505267b8659ca9f34a1b5056748f2e8ffe1969e7f7ea45619432a82a9",
      "evalId": "evals%2Fskill.eval.ts › uses the marker with the marked skill",
      "kind": "too-few-tries",
      "severity": "suggestion",
      "text": "Marked passed 2 of 2 tries and plain 0 of 2: too few tries to tell whether the difference holds.",
      "evidence": [
        "evals%2Fskill.eval.ts › uses the marker with the marked skill/fake+marked+docker",
        "evals%2Fskill.eval.ts › uses the marker with the marked skill/fake+plain+docker"
      ],
      "fix": {
        "at": "source:evals/skill.eval.ts#L6",
        "edit": "set runs: 4 or more, so each side counts at least 4 tries"
      },
      "origin": "deterministic",
      "firstSeenRun": "20261021T185234Z_f3a9e44_cursor-agent_994w",
      "printed": false
    }
  ],
  "validation": {
    "dropped": 0,
    "regenerated": 0,
    "drops": []
  }
}
